ID,ENTRYTYPE,file,doi,grobid-version,author,journal,title,year,volume,number,note
000399,article,data/pdfs/2_1/Galliers1993f.pdf,,lfoppiano/grobid:0.8.1,,The Journal of Strategic Information Systems,,,2,1,
000400,article,data/pdfs/2_1/JelassiDutta1993.pdf,,lfoppiano/grobid:0.8.1,"Jelassi, Tawfik and Dutta, Soumitra",The Journal of Strategic Information Systems,Integrating global commercial operations with information technology at BP Chemicals,,2,1,
000401,article,data/pdfs/2_1/ClarkeJenkins1993.pdf,,lfoppiano/grobid:0.8.1,"Clarke, Roger and Jenkins, Michael",The Journal of Strategic Information Systems,The strategic intent of on-line trading systems: a case study in national livestock marketing,,2,1,
000402,article,data/pdfs/2_1/ApteVepsalainen1993.pdf,,lfoppiano/grobid:0.8.1,"Apte, Uday M and Vepsfikiinen, Ari P J",The Journal of Strategic Information Systems,High tech or high touch? Efficient channel strategies for delivering financial services,,2,1,
000403,article,data/pdfs/2_1/Hunter1993.pdf,,lfoppiano/grobid:0.8.1,"Gordon Hunter, M.",The Journal of Strategic Information Systems,A strategy for identifying analysts,,2,1,
000404,article,data/pdfs/2_1/RaghunathanRaghunathan1993.pdf,,lfoppiano/grobid:0.8.1,"Raghunathan, Bhanu and Raghunathan, T. S",The Journal of Strategic Information Systems,Does the reporting level of the information systems executive make a difference?,,2,1,
000405,article,data/pdfs/8_4/MinSuhKim1999.pdf,,lfoppiano/grobid:0.8.1,"Min, S. K and Suh, E. H and Kim, S. Y",The Journal of Strategic Information Systems,An integrate d approac h toward strategi c information systems planning,,8,4,
000406,article,data/pdfs/8_4/Powell1999.pdf,,lfoppiano/grobid:0.8.1,"Angell, Ian and Kogan",The Journal of Strategic Information Systems,The New Barbarian Manifesto,,8,4,Book review
000407,article,data/pdfs/8_4/AvisonCuthbertsonPowell1999.pdf,,lfoppiano/grobid:0.8.1,"Avison, D. E and Cuthbertson, C. H and Powell, P.",The Journal of Strategic Information Systems,The paradox of information systems: strategic value and low status,,8,4,
000408,article,data/pdfs/8_4/Lanzara1999.pdf,,lfoppiano/grobid:0.8.1,"Lanzara, G. F",The Journal of Strategic Information Systems,Between transient constructs and persistent structures: designing systems in action ଝ,,8,4,
000409,article,data/pdfs/8_4/ButlerFitzgerald1999.pdf,,lfoppiano/grobid:0.8.1,"Butler, T. and Fitzgerald, Brian",The Journal of Strategic Information Systems,Unpacking the systems development process: an empirical application of the CSF concept in a research context,,8,4,
000410,article,data/pdfs/8_4/LarsenMyers1999.pdf,,lfoppiano/grobid:0.8.1,"Larsen, M. A and Myers",The Journal of Strategic Information Systems,When success turns into failure: a package-driven business process re-engineering project in the financial services industry,,8,4,
000411,article,data/pdfs/8_4/Galliers1999c.pdf,,lfoppiano/grobid:0.8.1,"Min, Seung Ki and Suh, Eui-Ho",The Journal of Strategic Information Systems,,,8,4,
000412,article,data/pdfs/8_4/AnonymousNoYearay.pdf,,lfoppiano/grobid:0.8.1,,The Journal of Strategic Information Systems,,,8,4,Book review
000413,article,data/pdfs/9_2/Fowler2000.pdf,,lfoppiano/grobid:0.8.1,"Fowler, Alan and Eng, C.",The Journal of Strategic Information Systems,The role of AI-based technology in support of the knowledge management value activity cycle,,9,2,
000414,article,data/pdfs/9_2/Leidner2000a.pdf,,lfoppiano/grobid:0.8.1,,The Journal of Strategic Information Systems,,,9,2,
000415,article,data/pdfs/9_2/WaskoFaraj2000.pdf,,lfoppiano/grobid:0.8.1,"Mclure Wasko, M. and Faraj, S.",The Journal of Strategic Information Systems,ªIt is what one doesº: why people participate and help others in electronic communities of practice,,9,2,
000416,article,data/pdfs/9_2/Merali2000.pdf,,lfoppiano/grobid:0.8.1,"Merali, Y.",The Journal of Strategic Information Systems,Individual and collective congruence in the knowledge management process,,9,2,
000417,article,data/pdfs/9_2/SchultzeBolandJr2000.pdf,,lfoppiano/grobid:0.8.1,"Schultze, U. and Boland, R. J",The Journal of Strategic Information Systems,Knowledge management technology and the reproduction of knowledge work practices,,9,2,
000418,article,data/pdfs/9_2/HolsappleJoshi2000.pdf,,lfoppiano/grobid:0.8.1,"Holsapple, C. W and Joshi, K. D",The Journal of Strategic Information Systems,An investigation of factors that in¯uence the management of knowledge in organizations,,9,2,
000419,article,data/pdfs/9_2/Gray2000.pdf,,lfoppiano/grobid:0.8.1,"Gray, Peter H",The Journal of Strategic Information Systems,The effects of knowledge management systems on emergent teams: towards a research model,,9,2,
000420,article,data/pdfs/9_2/JarvenpaaStaples2000.pdf,,lfoppiano/grobid:0.8.1,"Jarvenpaa, S. L and Staples, D. S",The Journal of Strategic Information Systems,The use of collaborative electronic media for information sharing: an exploratory study of determinants,,9,2,
000421,article,data/pdfs/15_2/WattsHenderson2006.pdf,10.1016/J.JSIS.2005.08.001,lfoppiano/grobid:0.8.1,"Watts, Stephanie and Henderson, John C",The Journal of Strategic Information Systems,Innovative IT climates: CIO perspectives,2005,15,2,
000422,article,data/pdfs/15_2/CurrieParikh2006.pdf,10.1016/J.JSIS.2005.10.001,lfoppiano/grobid:0.8.1,"Currie, Wendy L and Parikh, Mihir A",The Journal of Strategic Information Systems,Value creation in web services: An integrative model,2005,15,2,
000423,article,data/pdfs/15_2/KirschHaney2006.pdf,10.1016/J.JSIS.2005.08.002,lfoppiano/grobid:0.8.1,"Kirsch, Laurie J and Haney, Mark H",The Journal of Strategic Information Systems,Requirements determination for common systems: turning a global vision into a local reality,2005,15,2,
000424,article,data/pdfs/15_2/Shih2006.pdf,10.1016/J.JSIS.2005.08.004,lfoppiano/grobid:0.8.1,"Shih, Hung-Pin",The Journal of Strategic Information Systems,Technology-push and communication-pull forces driving message-based coordination performance,2005,15,2,
000425,article,data/pdfs/15_2/GalliersJarvenpaa2006c.pdf,10.1016/J.JSIS.2006.03.001,lfoppiano/grobid:0.8.1,"Haney, Mark H",The Journal of Strategic Information Systems,,,15,2,
000426,article,data/pdfs/15_3/WhittenWakefield2006.pdf,10.1016/J.JSIS.2005.11.002,lfoppiano/grobid:0.8.1,"Whitten, Dwayne and Wakefield, Robin L",The Journal of Strategic Information Systems,Measuring switching costs in IT outsourcing services,2006,15,3,
000427,article,data/pdfs/15_3/GregorMartinFernandezEtAl2006.pdf,10.1016/J.JSIS.2006.04.001,lfoppiano/grobid:0.8.1,"Gregor, Shirley and Martin, Michael and Fernandez, Walter and Stern, Steven and Vitale, Michael",The Journal of Strategic Information Systems,The transformational dimension in the realization of business value from information technology,,15,3,
000428,article,data/pdfs/15_3/Wastell2006.pdf,10.1016/J.JSIS.2005.11.001,lfoppiano/grobid:0.8.1,"Wastell, David G",The Journal of Strategic Information Systems,Information systems and evidence-based policy in multi-agency networks: The micro-politics of situated innovation,2006,15,3,
000429,article,data/pdfs/15_3/GalliersJarvenpaa2006b.pdf,10.1016/J.JSIS.2006.06.001,lfoppiano/grobid:0.8.1,"Heejin, Sangjo Oh and Galliers, Robert D and Jarvenpaa, Sirkka L",The Journal of Strategic Information Systems,,,15,3,
000430,article,data/pdfs/15_3/LeeOh2006.pdf,10.1016/J.JSIS.2005.10.002,lfoppiano/grobid:0.8.1,"Lee, Heejin and Oh, Sangjo",The Journal of Strategic Information Systems,A standards war waged by a developing country: Understanding international standard setting from the actor-network perspective,2006,15,3,
000431,article,data/pdfs/25_2/WakefieldWakefield2016.pdf,10.1016/J.JSIS.2016.04.001,lfoppiano/grobid:0.8.1,"Wakefield, Robin and Wakefield, Kirk",The Journal of Strategic Information Systems,Social media network behavior: A study of user passion and affect,2016,25,2,
000432,article,data/pdfs/25_2/RenaudWalshKalika2016.pdf,10.1016/J.JSIS.2016.01.002,lfoppiano/grobid:0.8.1,"Alexandre, Renaud and Isabelle, Walsh and Michel, Kalika",The Journal of Strategic Information Systems,Is SAM still alive? A bibliometric and interpretive mapping of the strategic alignment research field,2016,25,2,
000433,article,data/pdfs/25_2/BenlianHaffke2016.pdf,10.1016/J.JSIS.2016.01.001,lfoppiano/grobid:0.8.1,"Benlian, Alexander and Haffke, Ingmar",The Journal of Strategic Information Systems,Does mutuality matter? Examining the bilateral nature and effects of CEO-CIO mutual understanding,2016,25,2,
000434,article,data/pdfs/25_2/BenthausRisiusBeck2016.pdf,10.1016/J.JSIS.2015.12.001,lfoppiano/grobid:0.8.1,"Benthaus, Janek and Risius, Marten and Beck, Roman",The Journal of Strategic Information Systems,Social media management strategies for organizational impression management and their effect on public perception,2016,25,2,
000435,article,data/pdfs/25_2/GalliersJarvenpaa2016a.pdf,10.1016/J.JSIS.2016.05.003,lfoppiano/grobid:0.8.1,"Galliers, Bob",The Journal of Strategic Information Systems,Editorial,,25,2,Contents
000436,article,data/pdfs/21_1/PillayHackneyBraganza2012.pdf,10.1016/J.JSIS.2011.12.002,lfoppiano/grobid:0.8.1,"Pillay, John and Hackney, Ray and Braganza, Ashley",The Journal of Strategic Information Systems,Informing strategic IS change: Towards a 'meta-learning' framework,2012,21,1,
000437,article,data/pdfs/21_1/MarabelliNewell2012.pdf,10.1016/J.JSIS.2011.11.002,lfoppiano/grobid:0.8.1,"Marabelli, Marco and Newell, Sue",The Journal of Strategic Information Systems,Knowledge risks in organizational networks: The practice perspective,2011,21,1,
000438,article,data/pdfs/21_1/MontazemiPittawaySaremiEtAl2012.pdf,10.1016/J.JSIS.2012.01.001,lfoppiano/grobid:0.8.1,"Montazemi, Ali Reza and Pittaway, Jeffrey James and Saremi, Hamed Qahri and Wei, Yongbin",The Journal of Strategic Information Systems,Factors of stickiness in transfers of know-how between MNC units,2012,21,1,
000439,article,data/pdfs/21_1/GalliersJarvenpaa2012a.pdf,10.1016/J.JSIS.2012.02.001,lfoppiano/grobid:0.8.1,,The Journal of Strategic Information Systems,Celebrating 20 years of JSIS,,21,1,Contents
000440,article,data/pdfs/21_1/TrkmanDesouza2012.pdf,10.1016/J.JSIS.2011.11.001,lfoppiano/grobid:0.8.1,"Trkman, Peter and Desouza, Kevin C",The Journal of Strategic Information Systems,Knowledge risks in organizational networks: An exploratory framework,2011,21,1,
000441,article,data/pdfs/21_1/ChuaLimSohEtAl2012.pdf,10.1016/J.JSIS.2011.12.001,lfoppiano/grobid:0.8.1,"Eng, Cecil and Chua, Huang and Lim, Wee-Kiat and Soh, Christina and Sia, Siew Kien",The Journal of Strategic Information Systems,Client strategies in vendor transition: A threat balancing perspective,2012,21,1,
000442,article,data/pdfs/16_2/DhillonBackhouseRay2007.pdf,10.1016/J.JSIS.2007.05.002,lfoppiano/grobid:0.8.1,"Dhillon, Gurpreet and Backhouse, James and Ray, Amy",The Journal of Strategic Information Systems,Editorial: JSIS Security and Privacy Special Issue,2007,16,2,
000443,article,data/pdfs/16_2/DulipoviciBaskerville2007.pdf,10.1016/J.JSIS.2007.05.007,lfoppiano/grobid:0.8.1,"Dulipovici, Alina and Baskerville, Richard",The Journal of Strategic Information Systems,Conflicts between privacy and property: The discourse in personal and organizational knowledge,2007,16,2,
000444,article,data/pdfs/16_2/Thiesse2007.pdf,10.1016/J.JSIS.2007.05.006,lfoppiano/grobid:0.8.1,"´de ´ric Thiesse, Fre",The Journal of Strategic Information Systems,"RFID, privacy and the perception of risk: A strategic framework",2007,16,2,
000445,article,data/pdfs/16_2/DjekicLoebbecke2007.pdf,10.1016/J.JSIS.2007.05.005,lfoppiano/grobid:0.8.1,"Djekic, Petar and Loebbecke, Claudia",The Journal of Strategic Information Systems,Preventing application software piracy: An empirical investigation of technical copy protections,2007,16,2,
000446,article,data/pdfs/16_2/Vaast2007.pdf,10.1016/J.JSIS.2007.05.003,lfoppiano/grobid:0.8.1,"Vaast, Emmanuelle",The Journal of Strategic Information Systems,Danger is in the eye of the beholders: Social representations of Information Systems security in healthcare,2007,16,2,
000447,article,data/pdfs/16_2/HuHartCooke2007.pdf,10.1016/J.JSIS.2007.05.004,lfoppiano/grobid:0.8.1,"Hu, Qing and Hart, Paul and Cooke, Donna",The Journal of Strategic Information Systems,The role of external and internal influences on information systems security -a neo-institutional perspective q,2007,16,2,
000448,article,data/pdfs/2_4/SohNeoMarkus1993.pdf,,lfoppiano/grobid:0.8.1,"Soh, Christina and Neo, Siong and Lynne, M. and Ne0, B. S and Markus, M. L",The Journal of Strategic Information Systems,IT2000: A critical appraisal of Singapore's state-wide strategic planning process for information technology,1993,2,4,
000449,article,data/pdfs/2_4/Fitzgerald1993.pdf,,lfoppiano/grobid:0.8.1,"Fitzgerald, Edmond P",The Journal of Strategic Information Systems,Success measures for information systems strategic planning,,2,4,
000450,article,data/pdfs/2_4/DavidowMaloneNoYear.pdf,,lfoppiano/grobid:0.8.1,"Davidow, William H and Malone, Michael S",The Journal of Strategic Information Systems,,,2,4,
000451,article,data/pdfs/2_4/Galliers1993c.pdf,,lfoppiano/grobid:0.8.1,"Galliers, Robert D",The Journal of Strategic Information Systems,IT strategies: beyond competitive advantage,,2,4,
000452,article,data/pdfs/2_4/Powell1993.pdf,,lfoppiano/grobid:0.8.1,"Powell, Philip",The Journal of Strategic Information Systems,Causality in the alignment of information technology and business strategy,,2,4,
000453,article,data/pdfs/2_4/FlynnGoleniewska1993.pdf,,lfoppiano/grobid:0.8.1,"Flynn, Donal J and Goleniewska, Eva",The Journal of Strategic Information Systems,A survey of the use of strategic information systems planning approaches in UK organizations,,2,4,
000454,article,data/pdfs/18_1/LucasJrOhWeber2009.pdf,10.1016/J.JSIS.2009.01.003,lfoppiano/grobid:0.8.1,"Lucas, Henry C and Oh, Wonseok and Weber, Bruce W",The Journal of Strategic Information Systems,"The defensive use of IT in a newly vulnerable market: The New York Stock Exchange, 1980-2007",2009,18,1,
000455,article,data/pdfs/18_1/WangAhmed2009.pdf,10.1016/J.JSIS.2008.11.001,lfoppiano/grobid:0.8.1,"Wang, Yong and Ahmed, Pervaiz K",The Journal of Strategic Information Systems,The moderating effect of the business strategic orientation on eCommerce adoption: Evidence from UK family run SMEs,2009,18,1,
000456,article,data/pdfs/18_1/KrellMatook2009.pdf,10.1016/J.JSIS.2008.12.001,lfoppiano/grobid:0.8.1,"Krell, Katharina and Matook, Sabine",The Journal of Strategic Information Systems,Competitive advantage from mandatory investments: An empirical study of Australian firms,2009,18,1,
000457,article,data/pdfs/18_1/Laffey2009.pdf,10.1016/J.JSIS.2009.01.001,lfoppiano/grobid:0.8.1,"Laffey, Des",The Journal of Strategic Information Systems,Click trading: A case study of Moneynet,2009,18,1,
000458,article,data/pdfs/18_1/GalliersJarvenpaa2009a.pdf,10.1016/S0963-8687(09)00012-2,lfoppiano/grobid:0.8.1,"Jarvenpaa"", ""Bob Galliers; Sirkka",The Journal of Strategic Information Systems,JSIS Editorial March 2009,2009,18,1,Contents
000459,article,data/pdfs/18_1/LucasJrGoh2009.pdf,10.1016/J.JSIS.2009.01.002,lfoppiano/grobid:0.8.1,"Lucas, Henry C and Goh, Jie Mein",The Journal of Strategic Information Systems,Disruptive technology: How Kodak missed the digital photography revolution,2009,18,1,
000460,article,data/pdfs/20_1/ZhangLiuLi2011.pdf,10.1016/J.JSIS.2011.01.001,lfoppiano/grobid:0.8.1,"Zhang, He and Liu, Lin and Li, Tong",The Journal of Strategic Information Systems,Designing IT systems according to environmental settings: A strategic analysis framework,2011,20,1,
000461,article,data/pdfs/20_1/BoseLuo2011.pdf,10.1016/J.JSIS.2011.01.003,lfoppiano/grobid:0.8.1,"Bose, Ranjit and Luo, Xin",The Journal of Strategic Information Systems,Integrative framework for assessing firms' potential to undertake Green IT initiatives via virtualization -A theoretical perspective,,20,1,
000462,article,data/pdfs/20_1/BengtssonAgerfalk2011.pdf,10.1016/J.JSIS.2010.09.007,lfoppiano/grobid:0.8.1,"Bengtsson, Fredrik and Ågerfalk, Pär J",The Journal of Strategic Information Systems,Information technology as a change actant in sustainability innovation: Insights from Uppsala,2010,20,1,
000463,article,data/pdfs/20_1/DesAutelsBerthon2011.pdf,10.1016/J.JSIS.2010.09.003,lfoppiano/grobid:0.8.1,"Desautels, Philip and Berthon, Pierre",The Journal of Strategic Information Systems,The PC (polluting computer): Forever a tragedy of the commons?,2010,20,1,
000464,article,data/pdfs/20_1/DaoLangellaCarbo2011.pdf,10.1016/J.JSIS.2011.01.002,lfoppiano/grobid:0.8.1,"Dao, Viet and Langella, Ian and Carbo, Jerry",The Journal of Strategic Information Systems,From green to sustainability: Information Technology and an integrated sustainability framework,2011,20,1,
000465,article,data/pdfs/20_1/WatsonBoudreauChenEtAl2011.pdf,10.1016/J.JSIS.2010.09.004,lfoppiano/grobid:0.8.1,"Watson, Richard T and Boudreau, Marie-Claude and Chen, Adela J and Sepúlveda, Héctor Hito",The Journal of Strategic Information Systems,Green projects: An information drives analysis of four cases,2010,20,1,
000466,article,data/pdfs/20_1/BerthonDonnellan2011.pdf,10.1016/J.JSIS.2011.02.001,lfoppiano/grobid:0.8.1,"Berthon, Pierre and Donnellan, Brian",The Journal of Strategic Information Systems,S ournal of Strategic Information Systems a,2011,20,1,Contents
000467,article,data/pdfs/20_1/PittParentJunglasEtAl2011.pdf,10.1016/J.JSIS.2010.09.005,lfoppiano/grobid:0.8.1,"Pitt, Leyland F and Parent, Michael and Junglas, Iris and Chan, Anthony and Spyropoulou, Stavroula",The Journal of Strategic Information Systems,"Integrating the smartphone into a sound environmental information systems strategy: Principles, practices and a research agenda q",2010,20,1,
000468,article,data/pdfs/20_1/GalliersJarvenpaa2011.pdf,10.1016/J.JSIS.2011.02.002,lfoppiano/grobid:0.8.1,"Galliers, Bob",The Journal of Strategic Information Systems,A warm welcome to Volume 20 of the Journal of Strategic Information Systems!,,20,1,Contents
000469,article,data/pdfs/20_1/Butler2011.pdf,10.1016/J.JSIS.2010.09.006,lfoppiano/grobid:0.8.1,"Butler, Tom",The Journal of Strategic Information Systems,Compliance with institutional imperatives on environmental sustainability: Building theory on the role of Green IS,2010,20,1,
000470,article,data/pdfs/4_4/Eardley1995.pdf,,lfoppiano/grobid:0.8.1,"Sauer, Chris",The Journal of Strategic Information Systems,Why Information Systems Fail: A Case Study Approach,,4,4,Book review
000471,article,data/pdfs/4_4/Galliers1995a.pdf,,lfoppiano/grobid:0.8.1,"Galliers, Robert D",The Journal of Strategic Information Systems,,,4,4,
000472,article,data/pdfs/4_4/JordanTricker1995.pdf,,lfoppiano/grobid:0.8.1,"Jordan, Ernest and Tricker, Bob",The Journal of Strategic Information Systems,Information strategy: alignment with organization structure,,4,4,
000473,article,data/pdfs/4_4/IgbariaMeredithSmith1995.pdf,,lfoppiano/grobid:0.8.1,"Igbaria, Magid and Meredith, Guy and Smith, Derek C",The Journal of Strategic Information Systems,Career orientations of information systems employees in South Africa,,4,4,
000474,article,data/pdfs/4_4/AdamMurphy1995.pdf,,lfoppiano/grobid:0.8.1,"Adam, Frederic and Murphy, Ciaran",The Journal of Strategic Information Systems,Information flows amongst executives: their implications for systems development,,4,4,
000475,article,data/pdfs/24_4/GalliersJarvenpaa2015a.pdf,10.1016/J.JSIS.2015.10.001,lfoppiano/grobid:0.8.1,"Galliers, Bob",The Journal of Strategic Information Systems,Editorial,,24,4,Contents
000476,article,data/pdfs/24_4/KalteneckerHessHuesig2015.pdf,10.1016/J.JSIS.2015.08.006,lfoppiano/grobid:0.8.1,"Kaltenecker, Natalie and Hess, Thomas and Huesig, Stefan",The Journal of Strategic Information Systems,Managing potentially disruptive innovations in software companies: Transforming from On-premises to the On-demand,2015,24,4,
000477,article,data/pdfs/24_4/Gleasure2015.pdf,10.1016/J.JSIS.2015.09.001,lfoppiano/grobid:0.8.1,"Gleasure, Rob",The Journal of Strategic Information Systems,Resistance to crowdfunding among entrepreneurs: An impression management perspective,2015,24,4,
000478,article,data/pdfs/24_4/SandeepRavishankar2015.pdf,10.1016/J.JSIS.2015.09.002,lfoppiano/grobid:0.8.1,"Sandeep, M. S and Ravishankar, M. N",The Journal of Strategic Information Systems,Social innovations in outsourcing: An empirical investigation of impact sourcing companies in India,2015,24,4,
000479,article,data/pdfs/24_4/AubertKishoreIriyama2015.pdf,10.1016/J.JSIS.2015.10.003,lfoppiano/grobid:0.8.1,"Aubert, Benoit A and Kishore, Rajiv and Iriyama, Akie",The Journal of Strategic Information Systems,"Exploring and managing the ''innovation through outsourcing"" paradox q",2015,24,4,
000480,article,data/pdfs/24_4/KotlarskyOshriLeeEtAl2015.pdf,10.1016/J.JSIS.2015.10.002,lfoppiano/grobid:0.8.1,"Kotlarsky, Julia",The Journal of Strategic Information Systems,Editorial: Understanding strategic innovation in IT and business process outsourcing,,24,4,Contents
000481,article,data/pdfs/1_4/Leighfield1992.pdf,,lfoppiano/grobid:0.8.1,"Leighfield, John",The Journal of Strategic Information Systems,Outsourcing and the trailing edge of technology,,1,4,
000482,article,data/pdfs/1_4/Watts1992d.pdf,,lfoppiano/grobid:0.8.1,"Watts, Julian",The Journal of Strategic Information Systems,Case Study Editorial,,1,4,
000483,article,data/pdfs/1_4/ChanHuff1992.pdf,,lfoppiano/grobid:0.8.1,"Chan, Yolande E and Huff, Sid L and Morrison, Allen and Crossan, Mary",The Journal of Strategic Information Systems,Strategy: an information systems research perspective,,1,4,
000484,article,data/pdfs/1_4/Baets1992.pdf,,lfoppiano/grobid:0.8.1,"Baets, Walter",The Journal of Strategic Information Systems,Aligning information systems with business strategy,,1,4,
000485,article,data/pdfs/1_4/BradyCameronTargettEtAl1992.pdf,,lfoppiano/grobid:0.8.1,"Brady, Tim and Cameron, Ross and Targett, David and Beaumont, Chris",The Journal of Strategic Information Systems,Strategic IT issues: the views of some major IT invktors,,1,4,
000486,article,data/pdfs/1_4/RobertsonCowley1992.pdf,,lfoppiano/grobid:0.8.1,"Robertson, S. R M and Cowley, L. H F",The Journal of Strategic Information Systems,Business strategy workshop -a framework for planning,,1,4,
000487,article,data/pdfs/1_4/Galliers1992b.pdf,,lfoppiano/grobid:0.8.1,,The Journal of Strategic Information Systems,,,1,4,
000488,article,data/pdfs/1_4/Rands1992a.pdf,,lfoppiano/grobid:0.8.1,"Rands, Tony",The Journal of Strategic Information Systems,The key role of applications software make-or-buy decisions,,1,4,
000489,article,data/pdfs/16_3/Coltman2007.pdf,10.1016/J.JSIS.2007.05.001,lfoppiano/grobid:0.8.1,"Coltman, Tim",The Journal of Strategic Information Systems,Why build a customer relationship management capability?,2007,16,3,
000490,article,data/pdfs/16_3/Tallon2007.pdf,10.1016/J.JSIS.2007.04.001,lfoppiano/grobid:0.8.1,"Tallon, Paul P",The Journal of Strategic Information Systems,Does IT pay to focus? An analysis of IT business value under single and multi-focused business strategies,2007,16,3,
000491,article,data/pdfs/16_3/Gosain2007.pdf,10.1016/J.JSIS.2007.02.001,lfoppiano/grobid:0.8.1,"Gosain, Sanjay",The Journal of Strategic Information Systems,Mobilizing software expertise in personal knowledge exchanges q,2007,16,3,
000492,article,data/pdfs/16_3/vonKroghSpaeth2007.pdf,10.1016/J.JSIS.2007.06.001,lfoppiano/grobid:0.8.1,"Von Krogh, Georg and Spaeth, Sebastian",The Journal of Strategic Information Systems,The open source software phenomenon: Characteristics that promote research q,2007,16,3,
000493,article,data/pdfs/16_3/GalliersJarvenpaa2007b.pdf,10.1016/J.JSIS.2007.07.001,lfoppiano/grobid:0.8.1,"Galliers, Bob and Jarvenpaa, Sirkka",The Journal of Strategic Information Systems,,,16,3,
000494,article,data/pdfs/4_3/Morgan1995.pdf,,lfoppiano/grobid:0.8.1,"Morgan, Gareth G",The Journal of Strategic Information Systems,ITEM: a strategic approach to information systems in voluntary organizations,,4,3,
000495,article,data/pdfs/4_3/Galliers1995c.pdf,,lfoppiano/grobid:0.8.1,"Galliers, Robert D",The Journal of Strategic Information Systems,,,4,3,
000496,article,data/pdfs/4_3/AnonymousNoYearab.pdf,,lfoppiano/grobid:0.8.1,,The Journal of Strategic Information Systems,,,4,3,Book review
000497,article,data/pdfs/4_3/Noble1995.pdf,,lfoppiano/grobid:0.8.1,"Noble, Faith",The Journal of Strategic Information Systems,Implementation strategies for office systems,,4,3,
000498,article,data/pdfs/4_3/HeatleyAgarwalTanniru1995.pdf,,lfoppiano/grobid:0.8.1,"Heatley, James and Agarwal, Ritu and Tanniru, Mohan",The Journal of Strategic Information Systems,An evaluation of an innovative information technology the case of Carrier EXPERT,,4,3,
000499,article,data/pdfs/4_3/HasanLampitsi1995.pdf,,lfoppiano/grobid:0.8.1,"Hasan, Helen and Lampitsi, Stephanie",The Journal of Strategic Information Systems,Executive access to information systems in Australian public organizations,,4,3,
000500,article,data/pdfs/4_3/AnonymousNoYearac.pdf,,lfoppiano/grobid:0.8.1,,The Journal of Strategic Information Systems,,,4,3,Book review
000501,article,data/pdfs/4_3/Ballantine1995.pdf,,lfoppiano/grobid:0.8.1,"Farbey, B. and Land, F. and Targett, D.",The Journal of Strategic Information Systems,Book reviews How to Assess Your IT Investment: A Study of Methods and Practice,,4,3,Book review
000502,article,data/pdfs/4_3/WillcocksSmith1995.pdf,,lfoppiano/grobid:0.8.1,"Willcoeks, Leslie and Smith, Gill and Willcocks, L.",The Journal of Strategic Information Systems,IT-enabled business process reengineering: organizational and human resource dimensions,,4,3,
000503,article,data/pdfs/18_2/LeidnerPanPan2009.pdf,10.1016/J.JSIS.2009.05.001,lfoppiano/grobid:0.8.1,"Leidner, Dorothy E and Pan, Gary and Pan, Shan L",The Journal of Strategic Information Systems,The role of IT in crisis response: Lessons from the SARS and Asian Tsunami disasters,2009,18,2,
