ID,ENTRYTYPE,file,grobid-version,author,journal,volume,number,title,year,doi,note
0000000757,article,data/pdfs/23_5/KrancherOshriKotlarskyEtAl2022.pdf,lfoppiano/grobid:0.8.1,"Krancher, Oliver and Oshri, Ilan and Kotlarsky, Julia and Dibbern, Jens",Journal of the Association for Information Systems,23,5,Performance in Multisourcing Performance in Multisourcing,,10.17705/1JAIS.00751,
0000000758,article,data/pdfs/23_6/QuWangLuEtAl2022.pdf,lfoppiano/grobid:0.8.1,"Qu, Gang and Wang, Jingguo and Lu, Xin and Xu, Qi and Wang, Qi",Journal of the Association for Information Systems,23,6,Network Configuration in App Design: The Effects of Simplex and Multiplex Networks on Team Performance,,10.17705/1JAIS.00770,
0000000759,article,data/pdfs/23_2/ZhangLeeYooEtAl2022.pdf,lfoppiano/grobid:0.8.1,"Zhang, Zhewei and Lee, Habin and Yoo, Youngjin and Choi, Youngseok Thomas",Journal of the Association for Information Systems,23,2,Theorizing Routines with Computational Sequence Analysis: A Critical Realism Framework,,10.17705/1JAIS.00734,
0000000760,article,data/pdfs/23_2/ToreiniLangnerMaedcheEtAl2022.pdf,lfoppiano/grobid:0.8.1,"Toreini, Peyman and Langner, Moritz and Maedche, Alexander and Morana, Stefan and Vogel, Tobias",Journal of the Association for Information Systems,23,2,Designing Attentive Information Dashboards,,10.17705/1JAIS.00732,
0000000761,article,data/pdfs/23_6/GalHansenLee2022.pdf,lfoppiano/grobid:0.8.1,"Gal, Uri and Hansen, Sean and Lee, Allen S",Journal of the Association for Information Systems,23,6,,,10.17705/1JAIS.00784,
0000000762,article,data/pdfs/23_2/ChenKing2022.pdf,lfoppiano/grobid:0.8.1,"Chen, Shirley and King, John Leslie",Journal of the Association for Information Systems,23,2,Policy and Imprecise Concepts: The Case of Digital Transformation,,10.17705/1JAIS.00742,
0000000763,article,data/pdfs/23_6/LuoZhangLu2022.pdf,lfoppiano/grobid:0.8.1,"Luo, Xiaoxiao and Zhang, Jie and Li, Minqiang",Journal of the Association for Information Systems,23,6,Freemium Strategy in Competitive App Markets: Maintaining Profitability with Product Fit Uncertainty,,10.17705/1JAIS.00768,
0000000764,article,data/pdfs/23_2/SteiningerMikalefPateliEtAl2022.pdf,lfoppiano/grobid:0.8.1,"Steininger, Dennis M and Mikalef, Patrick and Pateli, Adamantia and Ortiz-De-Guinea, Ana",Journal of the Association for Information Systems,23,2,"Dynamic Capabilities in Information Systems Research: A Critical Review, Synthesis of Current Knowledge, and Recommendations for Future Research",,10.17705/1JAIS.00736,
0000000765,article,data/pdfs/23_6/SchreieckWiescheKrcmar2022.pdf,lfoppiano/grobid:0.8.1,"Schreieck, Maximilian and Wiesche, Manuel and Krcmar, Helmut",Journal of the Association for Information Systems,23,6,From Product Platform Ecosystem to Innovation Platform Ecosystem: An Institutional Perspective on the Governance of Ecosystem Transformations,,10.17705/1JAIS.00764,
0000000766,article,data/pdfs/22_6/VaghefiNazareth2021a.pdf,lfoppiano/grobid:0.8.1,"Sharif Vaghefi, Mahyar and Nazareth, Derek L and Mahyar, Sharif and Vaghefi",Journal of the Association for Information Systems,22,6,Mining Online Social Networks: Deriving User Preferences through Node Embedding,,10.17705/1JAIS.00711,
0000000767,article,data/pdfs/23_5/DingerThatcherGroverEtAl2022.pdf,lfoppiano/grobid:0.8.1,"Dinger, Michael ; and Thatcher, Jason Bennett and Grover, Varun and Tripp, John F and Bennett",Journal of the Association for Information Systems,23,5,,,10.17705/1JAIS.00763,
0000000768,article,data/pdfs/23_6/LuseTownsendMennecke2022.pdf,lfoppiano/grobid:0.8.1,"Luse, Andy ; and Townsend, Anthony M and Mennecke, Brian E and Mennecke",Journal of the Association for Information Systems,23,6,,,10.17705/1JAIS.00769,
0000000769,article,data/pdfs/23_6/Fink2022.pdf,lfoppiano/grobid:0.8.1,"Fink, Lior",Journal of the Association for Information Systems,23,6,Why and How Online Experiments Can Benefit Information Systems Research,,10.17705/1JAIS.00787,
0000000770,article,data/pdfs/23_6/JarvelainenNiemimaaZimmer2022.pdf,lfoppiano/grobid:0.8.1,"Järveläinen, Jonna and Niemimaa, Marko and Zimmer, Markus P",Journal of the Association for Information Systems,23,6,,,10.17705/1JAIS.00771,
0000000771,article,data/pdfs/23_5/VenkateshSpeierPeroAljafariEtAl2022.pdf,lfoppiano/grobid:0.8.1,"Venkatesh, Viswanath and Speier-Pero, Cheri and Aljafari, Ruba and Bala, Hillol",Journal of the Association for Information Systems,23,5,IT Use and Job Outcomes: A Longitudinal Field Study of Technology Contingencies,,10.17705/1JAIS.00760,
0000000772,article,data/pdfs/23_5/KaneKane2022.pdf,lfoppiano/grobid:0.8.1,"Kane, Gerald C",Journal of the Association for Information Systems,23,5,"How to Write an ""A"" Paper",,10.17705/1JAIS.00765,
0000000773,article,data/pdfs/23_5/WangYangYe2022.pdf,lfoppiano/grobid:0.8.1,"Wang, Xinwei and Yang, Xue and Ye, Jonathan",Journal of the Association for Information Systems,23,5,,,10.17705/1JAIS.00762,
0000000774,article,data/pdfs/20_8/ReckerGreen2019.pdf,lfoppiano/grobid:0.8.1,"Recker, Jan and Green, Peter F",Journal of the Association for Information Systems,20,8,How do Individuals Interpret Multiple Conceptual Models? A Theory of Combined Ontological Completeness and Overlap,,10.17705/1JAIS.00565,
0000000775,article,data/pdfs/23_2/HassanLowryMathiassen2022.pdf,lfoppiano/grobid:0.8.1,"Hassan, Nik Rushdi and Lowry, Paul Benjamin and Mathiassen, Lars and Benjamin, Paul and Quarterly, Mis",Journal of the Association for Information Systems,23,2,Useful Products in Information Systems Theorizing: A Discursive Formation Perspective,,10.17705/1JAIS.00730,
0000000776,article,data/pdfs/23_6/MullinsStewartGreitens2022.pdf,lfoppiano/grobid:0.8.1,"Mullins, Jeffrey K and Stewart, Patrick A and Greitens, Thomas J",Journal of the Association for Information Systems,23,6,Facing Forward: Policy for Automated Facial Expression Analysis,,10.17705/1JAIS.00788,
0000000777,article,data/pdfs/18_12/DobsonNicholson2017.pdf,lfoppiano/grobid:0.8.1,"Dobson, John Alver and Nicholson, Brian",Journal of the Association for Information Systems,18,12,Exploring the Dialectics Underlying Institutionalization of IT Exploring the Dialectics Underlying Institutionalization of IT Artifacts Artifacts,,10.17705/1JAIS.00478,
0000000778,article,data/pdfs/23_6/SohSetia2022.pdf,lfoppiano/grobid:0.8.1,"Soh, Franck and Setia, Pankaj",Journal of the Association for Information Systems,23,6,The Impact of Dominant IT Infrastructure in Multi-Establishment Firms: The Moderating Role of Environmental Dynamism,,10.17705/1JAIS.00773,
0000000779,article,data/pdfs/23_2/KwakDengKuemEtAl2022.pdf,lfoppiano/grobid:0.8.1,"Kwak, Dong-Heon and Deng, Shuyuan and Kuem, Jungwon and Kim, Sung S and Kwak, Austin and Deng, Lance",Journal of the Association for Information Systems,23,2,How to Achieve Goals in Digital Games: An Empirical Test of a Goal-Oriented Model in Pokémon GO,,10.17705/1JAIS.00733,
0000000780,article,data/pdfs/23_2/FadelMeservyKirwan2022.pdf,lfoppiano/grobid:0.8.1,"Fadel, Kelly J and Meservy, Thomas O and Kirwan, C. Brock",Journal of the Association for Information Systems,23,2,Information Filtering in Electronic Networks of Practice: An fMRI Investigation of Expectation (Dis)confirmation,,10.17705/1JAIS.00731,
0000000781,article,data/pdfs/23_6/MuellerBenlian2022.pdf,lfoppiano/grobid:0.8.1,"Mueller, Lea and Benlian, Alexander",Journal of the Association for Information Systems,23,6,,,10.17705/1JAIS.00766,
0000000782,article,data/pdfs/23_5/GalBerenteChasin2022.pdf,lfoppiano/grobid:0.8.1,"Gal, Uri and Berente, Nicholas and Chasin, Friedrich",Journal of the Association for Information Systems,23,5,Technology Lifecycles and Digital Technologies: Patterns of Discourse across Levels of Materiality,,10.17705/1JAIS.00761,
0000000783,article,data/pdfs/23_5/SalmelaBaiyereTapanainenEtAl2022.pdf,lfoppiano/grobid:0.8.1,"Salmela, Hannu and Baiyere, Abayomi and Tapanainen, Tommi and Galliers, Robert D",Journal of the Association for Information Systems,23,5,Digital Agility: Conceptualizing Agility for the Digital Era Digital Agility: Conceptualizing Agility for the Digital Era,,10.17705/1JAIS.00767,
0000000784,article,data/pdfs/23_5/TaftiRahmatiMithasEtAl2022.pdf,lfoppiano/grobid:0.8.1,"Tafti, Ali and Rahmati, Pouya and Mithas, Sunil and Krishnan, M. S",Journal of the Association for Information Systems,23,5,How Human Resource and Information Systems Practices Amplify the Returns on Information Technology Investments,,10.17705/1JAIS.00758,
0000000785,article,data/pdfs/19_4/SiponenBaskerville2018.pdf,lfoppiano/grobid:0.8.1,"Siponen, Mikko and Baskerville, Richard",Journal of the Association for Information Systems,19,4,Intervention Effect Rates as a Path to Research Relevance: Information Systems Security Example,,10.17705/1JAIS.00491,
0000000786,article,data/pdfs/23_5/KrusePuraoSeidel2022.pdf,lfoppiano/grobid:0.8.1,"Kruse, Leona Chandra and Purao, Sandeep and Seidel, Stefan and Kruse, Chandra and Purao, Leona ; and Seidel, Sandeep and Seidel, Stefan",Journal of the Association for Information Systems,23,5,How Designers Use Design Principles: Design Behaviors and How Designers Use Design Principles: Design Behaviors and Application Modes Application Modes,,10.17705/1JAIS.00759,
0000000787,article,data/pdfs/23_6/LeeParkZaggl2022.pdf,lfoppiano/grobid:0.8.1,"Lee, Jay "" and Park, Hyunwoo and Zaggl, Michael A",Journal of the Association for Information Systems,23,6,,,10.17705/1JAIS.00765,
0000000788,article,data/pdfs/18_12/KellyNoonan2017.pdf,lfoppiano/grobid:0.8.1,"Paper, Research and Kelly, Séamas and Noonan, Camilla",Journal of the Association for Information Systems,18,12,J ournal of the A I S ssociation for nformation ystems,2017,,
000789,article,data/pdfs/18_12/SahaySeinUrquhart2017.pdf,lfoppiano/grobid:0.8.1,"Sahay, Sundeep and Kyaw, Maung and Urquhart, Cathy",Journal of the Association for Information Systems,18,12,J ournal of the A I S ssociation for nformation ystems,,,
000790,article,data/pdfs/24_1/Social Movement Sustainability on Social Media_ An Analysis of th.pdf,lfoppiano/grobid:0.8.1,"Syed, Romilla and Silva, Leiser",Journal of the Association for Information Systems,24,1,,,10.17705/1JAIS.00776,
000791,article,data/pdfs/24_1/The Effects of Digitally Delivered Nudges in a Corporate Wellness.pdf,lfoppiano/grobid:0.8.1,"Babar, Yash and Curley, Shawn and Ke, Zhihong and Liu, De and Sheffler, Zachary",Journal of the Association for Information Systems,24,1,The Effects of Digitally Delivered Nudges in a Corporate Wellness Program,,10.17705/1JAIS.00783,
000793,article,data/pdfs/24_1/An Adversarial Dance_ Toward an Understanding of Insiders_ Respon.pdf,lfoppiano/grobid:0.8.1,"Balozian, Puzant and Burns, A. J and Leidner, Dorothy E",Journal of the Association for Information Systems,24,1,,,10.17705/1JAIS.00798,
000794,article,data/pdfs/24_1/The Effect of Community Managers on Online Idea Crowdsourcing Act.pdf,lfoppiano/grobid:0.8.1,"Hornuf, Lars and Jeworrek, Sabrina",Journal of the Association for Information Systems,24,1,The Effect of Community Managers on Online Idea The Effect of Community Managers on Online Idea Crowdsourcing Activities Crowdsourcing Activities,,10.17705/1JAIS.00777,
000795,article,data/pdfs/24_1/Algorithm Sensemaking_ How Platform Workers Make Sense of Algorit.pdf,lfoppiano/grobid:0.8.1,"Management, Algorithmic and Möhlmannn, Mareike and Alves, Carolina and Salge, Lima and Marabelli, Marco and Möhlmann, Mareike and Alves De Lima Salge, Carolina",Journal of the Association for Information Systems,24,1,Algorithm Sensemaking: How Platform Workers Make Sense of Algorithm Sensemaking: How Platform Workers Make Sense of,,10.17705/1JAIS.00774,
000796,article,data/pdfs/24_1/Guidelines for the Development of Three-Level Models_ Bridging Le.pdf,lfoppiano/grobid:0.8.1,"Venkatesh, Viswanath and Weng, Qin and Rai, Arun and Maruping, Likoebe M",Journal of the Association for Information Systems,24,1,,,10.17705/1JAIS.00778,
000797,article,data/pdfs/24_1/Same but Different_ Variations in Reactions to Digital Transforma.pdf,lfoppiano/grobid:0.8.1,"Strange Noesgaard, Mette and Nielsen, Jeppe Agger and Jensen, Tina Blegind and Mathiassen, Lars",Journal of the Association for Information Systems,24,1,,,10.17705/1JAIS.00770,
000798,article,data/pdfs/24_1/Assessing the Connections among Top Management Support IT Assimi.pdf,lfoppiano/grobid:0.8.1,"Roberts, Nicholas and Jeyaraj, Anand and Pullin, Jennifer E and Management",Journal of the Association for Information Systems,24,1,,,10.17705/1JAIS.00772,
000799,article,data/pdfs/24_1/Reconciling the Personalization-Privacy Paradox_ Exploring Privac.pdf,lfoppiano/grobid:0.8.1,"Zhu, Yu-Qian and Kanjanamekanant, Kritsapas and Chiu, Yi-Te",Journal of the Association for Information Systems,24,1,,,10.17705/1JAIS.00775,
000801,article,data/pdfs/24_2/Understanding Engagement in Online Health Communities_ A Trust-Ba.pdf,lfoppiano/grobid:0.8.1,"Connolly, Regina and Sanchez, Otavio Próspero and Compeau, Deborah and Martins, Fabiana and Tacco, Souza and Tacco, Fabiana",Journal of the Association for Information Systems,24,2,Understanding Engagement in Online Health Communities: A Understanding Engagement in Online Health Communities: A Trust-Based Perspective Trust-Based Perspective,,10.17705/1JAIS.00785,
000803,article,data/pdfs/24_2/Effects of Intellectual and Social Alignment on Organizational Ag.pdf,lfoppiano/grobid:0.8.1,"Hu, Hao and Wang, Nianxin and Liang, Huigang",Journal of the Association for Information Systems,24,2,Effects of Intellectual and Social Alignment on Organizational Agility: A Configurational Theory Approach,,10.17705/1JAIS.00780,
000805,article,data/pdfs/24_2/On the Effectiveness of Smart Metering Technology Adoption_ Evide.pdf,lfoppiano/grobid:0.8.1,"Sim, Jaeung and Lee, Junyeong and Cho, Daegon",Journal of the Association for Information Systems,24,2,On the Effectiveness of Smart Metering Technology Adoption: Evidence from the National Rollout in the United Kingdom,,10.17705/1JAIS.00786,
000806,article,data/pdfs/24_2/Avoiding the Diffusion of Responsibility in Social Networking Gro.pdf,lfoppiano/grobid:0.8.1,"Feng, Nan and Hu, Zhongtao and Wu, Yi and Choi, Ben",Journal of the Association for Information Systems,24,2,,,10.17705/1JAIS.00781,
000808,article,data/pdfs/24_2/Unraveling the Effects of Mobile Application Usage on Users_ Heal.pdf,lfoppiano/grobid:0.8.1,"Fu, Shaoxiong and Cai, Zhao and Lim, Eric T K and Liu, Yong and Tan, Chee-Wee and Lin, Yanqing and Deng, Shengli and Bennett, Jason",Journal of the Association for Information Systems,24,2,Unraveling the Effects of Mobile Application Usage on Users' Health Status: Insights from Conservation of Resources Theory,,10.17705/1JAIS.1JAIS.00808,
000809,article,data/pdfs/24_2/A Practical Guide for Successful Revisions and Engagements with R.pdf,lfoppiano/grobid:0.8.1,"Pang, Min-Seok and Thatcher, Jason B",Journal of the Association for Information Systems,24,2,A Practical Guide for Successful Revisions and Engagements with A Practical Guide for Successful Revisions and Engagements with Reviewers Reviewers,,10.17705/1JAIS.00797,
000810,article,data/pdfs/24_2/The Backstory of _An Adversarial Dance_.pdf,lfoppiano/grobid:0.8.1,"Leidner, Dorothy E and Burns, A. J and Balozian, Puzant",Journal of the Association for Information Systems,24,2,"The Backstory of ""An Adversarial Dance"" The Backstory of ""An Adversarial Dance""",,10.17705/1JAIS.00804,
000811,article,data/pdfs/25_3/About Theory and Theorizing.pdf,lfoppiano/grobid:0.8.1,"Leidner, Dorothy E and Gregory, Robert W",Journal of the Association for Information Systems,25,3,About Theory and Theorizing About Theory and Theorizing,,10.17705/1JAIS.00886,
000812,article,data/pdfs/25_3/The Impact of Feature Exploitation and Exploration on Mobile Appl.pdf,lfoppiano/grobid:0.8.1,"Shuraida, Shadi and Gao, Qiang and Safadi, Hani and Jain, Radhika",Journal of the Association for Information Systems,25,3,The Impact of Feature Exploitation and Exploration on Mobile Application Evolution and Success,,10.17705/1JAIS.00844,
000813,article,data/pdfs/25_3/The Effects of Featuring Product Sampling Reviews on E-Tailer Web.pdf,lfoppiano/grobid:0.8.1,"Lu, Xianghua and Chee, Wei and Phang and Ba, Sulin and Yao, Xinlin",Journal of the Association for Information Systems,25,3,The Effects of Featuring Product Sampling Reviews on E-Tailer Websites,,10.17705/1JAIS.00834,
000814,article,data/pdfs/25_3/The Contingent Effects of IS Certifications on the Trustworthines.pdf,lfoppiano/grobid:0.8.1,"Adam, Martin and Lins, Sebastian and Sunyaev, Ali and Benlian, Alexander",Journal of the Association for Information Systems,25,3,The Contingent Effects of IS Certifications on the Trustworthiness The Contingent Effects of IS Certifications on the Trustworthiness of Websites of Websites,,10.17705/1JAIS.00836,
000815,article,data/pdfs/25_3/Creating Collaboration_ How Social Movement Organizations Shape D.pdf,lfoppiano/grobid:0.8.1,"Ghobadi, Shahla and Sonenshein, Scott",Journal of the Association for Information Systems,25,3,Creating Collaboration: How Social Movement Organizations Shape Digital Activism to Promote Broader Social Change,,10.17705/1JAIS.00847,
000817,article,data/pdfs/25_3/Organizational Identity Management Policies.pdf,lfoppiano/grobid:0.8.1,"Rieger, Alexander and Roth, Tamara and Sedlmeir, Johannes and Fridgen, Gilbert and Young, Amber",Journal of the Association for Information Systems,25,3,Organizational Identity Management Policies Organizational Identity Management Policies,,10.17705/1JAIS.00887,
000818,article,data/pdfs/25_3/Digital Institutionalization_ The Case of E-Prescribing.pdf,lfoppiano/grobid:0.8.1,"Eriksson, Owen and Öhlund, Sten-Erik",Journal of the Association for Information Systems,25,3,Digital Institutionalization: The Case of E-Prescribing Digital Institutionalization: The Case of E-Prescribing,,10.17705/1JAIS.00845,
000819,article,data/pdfs/25_3/_My Name is Alexa. What_s Your Name__ The Impact of Reciprocal Se.pdf,lfoppiano/grobid:0.8.1,"Saffarizadeh, Kambiz and Keil, Mark and Boodraj, Maheshwar and Alashoor, Tawfiq and Bennett, Jason",Journal of the Association for Information Systems,25,3,Self-Disclosure on Post-Interaction Trust in Conversational Agents Self-Disclosure on Post-Interaction Trust in Conversational Agents,,10.17705/1JAIS.00839,
000820,article,data/pdfs/25_3/The Role of Online and Geographically Distant Social Networks in.pdf,lfoppiano/grobid:0.8.1,"Basak, Ecem and Tafti, Ali and Pang, Min-Seok",Journal of the Association for Information Systems,25,3,The Role of Online and Geographically Distant Social Networks in Political Decision-Making: Empirical Evidence from the 2016 United States Presidential Election,,10.17705/1JAIS.00851,
000822,article,data/pdfs/24_3/The Effectiveness of Highlighting Different Communication Orienta.pdf,lfoppiano/grobid:0.8.1,"Chee, Wei and Phang and Liao, Chengcheng and Fang, Zheng",Journal of the Association for Information Systems,24,3,,,10.17705/1JAIS.00803,
000825,article,data/pdfs/24_3/Does Analytics Help Resolve Equivocality in the Healthcare Contex.pdf,lfoppiano/grobid:0.8.1,"Adjerid, Idris and Angst, Corey M and Devaraj, Sarv and Berente, Nicholas",Journal of the Association for Information Systems,24,3,,,10.17705/1JAIS.00805,
000826,article,data/pdfs/24_3/Compete with Me_ The Impact of Online Gamified Competition on Exe.pdf,lfoppiano/grobid:0.8.1,"Yang, Yang and Khim, Yong and Goh and Hock, Hai and Teo and Tan, Sharon S L and Goh, Khim Yong",Journal of the Association for Information Systems,24,3,Compete with Me? The Impact of Online Gamified Competition on Compete with Me? The Impact of Online Gamified Competition on Exercise Behavior Exercise Behavior,,10.17705/1JAIS.00806,
000827,article,data/pdfs/24_3/_My Precious!__ A Values-Affordances Perspective on the Adoption.pdf,lfoppiano/grobid:0.8.1,"Lichti, Constantin W and Tumasjan, Andranik",Journal of the Association for Information Systems,24,3,,,10.17705/1JAIS.00790,
000828,article,data/pdfs/24_3/The Backstory of _Digital Agility Theory_.pdf,lfoppiano/grobid:0.8.1,"Galliers, Robert D and Salmela, Hannu and Tapanainen, Tommi and Baiyere, Abayomi",Journal of the Association for Information Systems,24,3,Journal of the Association for Information Systems Journal of the Association for Information Systems,,10.17705/1JAIS.00818,
000829,article,data/pdfs/24_3/Positively Fearful_ Activating the Individual_s HERO Within to Ex.pdf,lfoppiano/grobid:0.8.1,"Mattson, Thomas and Aurigemma, Sal and Ren, Jie",Journal of the Association for Information Systems,24,3,,,10.17705/1JAIS.00793,
000830,article,data/pdfs/24_3/How Do Paternalistic Leaders Motivate Employees_ Information Secu.pdf,lfoppiano/grobid:0.8.1,"Zhu, Jiawen and Feng, Gengzhong and Liang, Huigang and Tsui, Kwok-Leung and Chau, Patrick Y K",Journal of the Association for Information Systems,24,3,Security Compliance? Building a Climate and Applying Sanctions Security Compliance? Building a Climate and Applying Sanctions,,10.17705/1JAIS.00794,
000831,article,data/pdfs/24_3/Contextualizing Team Adaptation for Fostering Creative Outcomes i.pdf,lfoppiano/grobid:0.8.1,"Shirish, Anuragini and Srivastava, Shirish C and Boughzala, Imed",Journal of the Association for Information Systems,24,3,,,10.17705/1JAIS.00811,
000833,article,data/pdfs/24_6/Digital Transformation as Collective Social Action.pdf,lfoppiano/grobid:0.8.1,"Tana, Silviana and Breidbach, Christoph F and Burton-Jones, Andrew and Rowe, Frantz and Markus, M. Lynne",Journal of the Association for Information Systems,24,6,Digital Transformation as Collective Social Action Digital Transformation as Collective Social Action,,10.17705/1JAIS.00791,
000834,article,data/pdfs/24_6/Champions for Social Good_ How Can We Discover Social Sentiment a.pdf,lfoppiano/grobid:0.8.1,"Mukkamala, Raghava and Kauffman, Robert J and Henriksen, Helle Zinner and Rao Mukkamala, Raghava and Chiang, Roger and Abbasi, Ahmed and Xu, Jennifer and Raghava, Rao and Mukkamala",Journal of the Association for Information Systems,24,6,Sentiment and Attitude-Driven Patterns in Prosocial Sentiment and Attitude-Driven Patterns in Prosocial Communication? Communication?,,10.17705/1JAIS.00810,
000836,article,data/pdfs/24_6/Organizations as Digital Enactment Systems_ A Theory of Replaceme.pdf,lfoppiano/grobid:0.8.1,"Constantiou, Ioanna and Joshi, Mayur and Stelmaszak, Marta",Journal of the Association for Information Systems,24,6,Organizations as Digital Enactment Systems: A Theory of Organizations as Digital Enactment Systems: A Theory of,,10.17705/1JAIS.00833,
000837,article,data/pdfs/24_6/Taking the Person Seriously_ Ethically Aware IS Research in the E.pdf,lfoppiano/grobid:0.8.1,"Greene, Travis and Shmueli, Galit and Ray, Soumya and Chiang, Roger and Abbasi, Ahmed and Xu, Jennifer",Journal of the Association for Information Systems,24,6,,,10.17705/1JAIS.00800,
000839,article,data/pdfs/24_6/Data Science for Social Good.pdf,lfoppiano/grobid:0.8.1,"Abbasi, Ahmed and Chiang, Roger H L and Xu, Jennifer",Journal of the Association for Information Systems,24,6,Data Science for Social Good Data Science for Social Good,,10.17705/1JAIS.00849,
000843,article,data/pdfs/24_5/Security is Local_ The Influence of the Immediate Workgroup on In.pdf,lfoppiano/grobid:0.8.1,"Wang, David and Durcikova, Alexandra and Dennis, Alan R and Lowry, Paul Benjamin",Journal of the Association for Information Systems,24,5,Security is Local: The Influence of the Immediate Workgroup on Security is Local: The Influence of the Immediate Workgroup on Information Security Information Security,,10.17705/1JAIS.00812,
000844,article,data/pdfs/24_5/Positive or Negative Reviews_ Consumers_ Selective Exposure in Se.pdf,lfoppiano/grobid:0.8.1,"Lei, Zhanfei and Yin, Dezhi and Zhang, Han",Journal of the Association for Information Systems,24,5,,,10.17705/1JAIS.00823,
000847,article,data/pdfs/24_5/Digital Sustainability in Information Systems Research_ Conceptua.pdf,lfoppiano/grobid:0.8.1,"Kotlarsky, Julia and Oshri, Ilan and Sekulic, Nevena",Journal of the Association for Information Systems,24,5,,,10.17705/1JAIS.00825,
000849,article,data/pdfs/24_5/A Warning Approach to Mitigating Bandwagon Bias in Online Ratings.pdf,lfoppiano/grobid:0.8.1,"Wu, Ding and Guo, Xunhua and Wang, Yuejun and Chen, Guoqing",Journal of the Association for Information Systems,24,5,A Warning Approach to Mitigating Bandwagon Bias in Online Ratings: Theoretical Analysis and Experimental Investigations,,10.17705/1JAIS.00817,
000850,article,data/pdfs/24_5/The Role of AI-Based Artifacts_ Voice Capabilities for Agency Att.pdf,lfoppiano/grobid:0.8.1,"Schmitt, Anuschka and Zierau, Naim and Janson, Andreas and Leimeister, Jan Marco",Journal of the Association for Information Systems,24,5,The Role of AI-Based Artifacts' Voice Capabilities for Agency Attribution,,10.17705/1JAIS.00827,
000851,article,data/pdfs/25_2/Research Perspectives_ An Encompassing Framework for Conceptualiz.pdf,lfoppiano/grobid:0.8.1,"Haj-Bolouri, Amir and Conboy, Kieran and Gregor, Shirley and Conboy, Amir ;",Journal of the Association for Information Systems,25,2,,,10.17705/1JAIS.00830,
000852,article,data/pdfs/25_2/Proposing Shocks and Dissatisfaction to Explain Quitting and Swit.pdf,lfoppiano/grobid:0.8.1,"Maier, Christian and Laumer, Sven and Sun, Heshan and Thatcher, Jason Bennett and Weitzel, Tim",Journal of the Association for Information Systems,25,2,Proposing Shocks and Dissatisfaction to Explain Quitting and Switching a Service: An Image Theory Perspective,,10.17705/1JAIS.00857,
000853,article,data/pdfs/25_2/From Methodological Symmetry to Gaia_ Latour_s Legacy and Untappe.pdf,lfoppiano/grobid:0.8.1,"Aanestad, Margunn and Hanseth, Ole and Monteiro, Eric and Niemimaa, Marko and Ribes, David",Journal of the Association for Information Systems,25,2,Untapped Potential for IS Research Untapped Potential for IS Research,,10.17705/1JAIS.00881,
